    1 0.000000000 10.200.29.89 → 10.240.60.135 TCP 66 32930 → 22 [ACK] Seq=1 Ack=1 Win=380 Len=0 TSval=3176742335 TSecr=4141387803
    2 0.303849026 ExtremeNetwo_cc:fd:6d → Spanning-tree-(for-bridges)_00 STP 119 MST. Root = 32768/0/00:04:96:cc:fd:6d  Cost = 0  Port = 0x8009
    3 0.500481446 10.240.60.135 → 10.200.29.89 SSH 110 Server: Encrypted packet (len=44)
    4 0.576341009 10.200.29.89 → 10.240.60.135 TCP 66 32930 → 22 [ACK] Seq=1 Ack=45 Win=380 Len=0 TSval=3176742912 TSecr=4141388308
    5 0.756544247 10.240.60.135 → 10.200.29.89 SSH 110 Server: Encrypted packet (len=44)
    6 0.760356769 10.200.29.89 → 10.240.60.135 TCP 66 32930 → 22 [ACK] Seq=1 Ack=89 Win=380 Len=0 TSval=3176743095 TSecr=4141388564
    7 1.012446921 10.240.60.135 → 10.200.29.89 SSH 110 Server: Encrypted packet (len=44)
    8 1.082138032 10.200.29.89 → 10.240.60.135 TCP 66 32930 → 22 [ACK] Seq=1 Ack=133 Win=380 Len=0 TSval=3176743417 TSecr=4141388820
    9 1.268379913 10.240.60.135 → 10.200.29.89 SSH 110 Server: Encrypted packet (len=44)
   10 1.273276613 10.200.29.89 → 10.240.60.135 TCP 66 32930 → 22 [ACK] Seq=1 Ack=177 Win=380 Len=0 TSval=3176743608 TSecr=4141389076
