    1 0.000000000 10.230.3.155 → 10.240.60.113 TCP 66 34432 → 22 [ACK] Seq=1 Ack=1 Win=517 Len=0 TSval=2001917693 TSecr=1039576962
    2 0.179600369 10.240.60.113 → 10.230.3.155 SSH 110 Server: Encrypted packet (len=44)
    3 0.205350702 10.230.3.155 → 10.240.60.113 TCP 66 34432 → 22 [ACK] Seq=1 Ack=45 Win=517 Len=0 TSval=2001917899 TSecr=1039577218
    4 0.652132116 ExtremeNetwo_cc:fd:6d → Spanning-tree-(for-bridges)_00 STP 119 MST. Root = 32768/0/00:04:96:cc:fd:6d  Cost = 0  Port = 0x8009
    5 0.685943138 10.240.60.113 → 10.230.3.155 SSH 110 Server: Encrypted packet (len=44)
    6 0.687531946 10.230.3.155 → 10.240.60.113 TCP 66 34432 → 22 [ACK] Seq=1 Ack=89 Win=517 Len=0 TSval=2001918381 TSecr=1039577724
    7 0.941884806 10.240.60.113 → 10.230.3.155 SSH 110 Server: Encrypted packet (len=44)
    8 1.024793964 10.230.3.155 → 10.240.60.113 TCP 66 34432 → 22 [ACK] Seq=1 Ack=133 Win=517 Len=0 TSval=2001918718 TSecr=1039577980
    9 1.197820709 10.240.60.113 → 10.230.3.155 SSH 110 Server: Encrypted packet (len=44)
   10 1.228822588 10.230.3.155 → 10.240.60.113 TCP 66 34432 → 22 [ACK] Seq=1 Ack=177 Win=517 Len=0 TSval=2001918922 TSecr=1039578236
